id,name,location,services,rooms_quantity,image_id,rooms
1,Cosmos Collection Altay Resort,"Республика Алтай, Майминский район, село Урлу-Аспак, Лесхозная улица, 20","['Wi-Fi', 'Бассейн', 'Парковка', 'Кондиционер в номере']",15,1,"[<app.hotels.rooms.models.Rooms object at 0x0000017761780A70>, <app.hotels.rooms.models.Rooms object at 0x0000017761780AA0>]"
2,Skala,"Республика Алтай, Майминский район, поселок Барангол, Чуйская улица 40а","['Wi-Fi', 'Парковка']",23,2,"[<app.hotels.rooms.models.Rooms object at 0x0000017761780B00>, <app.hotels.rooms.models.Rooms object at 0x0000017761780B30>]"
3,Ару-Кёль,"Республика Алтай, Турочакский район, село Артыбаш, Телецкая улица, 44А",['Парковка'],30,3,"[<app.hotels.rooms.models.Rooms object at 0x0000017761780B90>, <app.hotels.rooms.models.Rooms object at 0x0000017761780BC0>]"
4,Гостиница Сыктывкар,"Республика Коми, Сыктывкар, Коммунистическая улица, 67","['Wi-Fi', 'Парковка', 'Тренажёрный зал']",55,4,"[<app.hotels.rooms.models.Rooms object at 0x0000017761780C20>, <app.hotels.rooms.models.Rooms object at 0x0000017761780C50>]"
5,Palace,"Республика Коми, Сыктывкар, Первомайская улица, 62","['Wi-Fi', 'Парковка', 'Кондиционер в номере']",22,5,"[<app.hotels.rooms.models.Rooms object at 0x0000017761780CB0>, <app.hotels.rooms.models.Rooms object at 0x0000017761780CE0>]"
6,Bridge Resort,"посёлок городского типа Сириус, Фигурная улица, 45","['Wi-Fi', 'Парковка', 'Кондиционер в номере', 'Тренажёрный зал']",45,6,[<app.hotels.rooms.models.Rooms object at 0x0000017761780D40>]
